{"config":{"digest":"sha256:ae86e7a57f7a4d973a4e3eb7217b347d1a430e35607c1e77716a10945336e8ad","path":".coveragerc"},"critical_modules":["src/quarry_recon/runner.py","src/quarry_recon/runner_supervisor.py","src/quarry_recon/runner_worker.py","src/quarry_recon/runner_repository.py","src/quarry_recon/runner_protocol.py","src/quarry_recon/store.py","src/quarry_recon/repository_identity.py","src/quarry_recon/privfs.py","src/quarry_recon/revision.py","src/quarry_recon/run_manifest.py","src/quarry_recon/campaign.py","src/quarry_recon/settle.py","src/quarry_recon/release_contracts.py","src/quarry_recon/release_evidence.py"],"h0_job_ids":[".github/workflows/ci.yml#jobs.offline[python-version=3.12,shard=0]",".github/workflows/ci.yml#jobs.offline[python-version=3.12,shard=1]",".github/workflows/ci.yml#jobs.offline[python-version=3.12,shard=2]",".github/workflows/ci.yml#jobs.offline[python-version=3.12,shard=3]",".github/workflows/ci.yml#jobs.offline[python-version=3.12,shard=4]",".github/workflows/ci.yml#jobs.offline[python-version=3.12,shard=5]"],"python":"3.12","release":"0.3.10","schema_version":"quarry.coverage-policy.v1","source_roster":["src/quarry_recon/__init__.py","src/quarry_recon/_fd_claims.py","src/quarry_recon/ast_obs.py","src/quarry_recon/bootstrap.py","src/quarry_recon/budget.py","src/quarry_recon/campaign.py","src/quarry_recon/cgroup.py","src/quarry_recon/checkpoint.py","src/quarry_recon/cli.py","src/quarry_recon/cloud.py","src/quarry_recon/config.py","src/quarry_recon/contract.py","src/quarry_recon/envelope.py","src/quarry_recon/events.py","src/quarry_recon/evidence.py","src/quarry_recon/exit_contract.py","src/quarry_recon/exports.py","src/quarry_recon/fault_runner_evidence.py","src/quarry_recon/fault_store_evidence.py","src/quarry_recon/fetch.py","src/quarry_recon/gadgets.py","src/quarry_recon/metrics.py","src/quarry_recon/netguard.py","src/quarry_recon/network_broker.py","src/quarry_recon/network_cdp.py","src/quarry_recon/network_dns.py","src/quarry_recon/network_policy.py","src/quarry_recon/network_proxy.py","src/quarry_recon/normalize.py","src/quarry_recon/notify.py","src/quarry_recon/nuclei_policy.py","src/quarry_recon/oob.py","src/quarry_recon/oos_regex.py","src/quarry_recon/osint.py","src/quarry_recon/osint_report.py","src/quarry_recon/output_contract.py","src/quarry_recon/pace.py","src/quarry_recon/path_identity_evidence.py","src/quarry_recon/phases/__init__.py","src/quarry_recon/phases/_local_raw.py","src/quarry_recon/phases/content.py","src/quarry_recon/phases/crawl.py","src/quarry_recon/phases/dns.py","src/quarry_recon/phases/enrich.py","src/quarry_recon/phases/horizontal.py","src/quarry_recon/phases/origin.py","src/quarry_recon/phases/params.py","src/quarry_recon/phases/probe.py","src/quarry_recon/phases/vertical.py","src/quarry_recon/policy.py","src/quarry_recon/private_files_evidence.py","src/quarry_recon/privfs.py","src/quarry_recon/registry.py","src/quarry_recon/release_contracts.py","src/quarry_recon/release_evidence.py","src/quarry_recon/release_h0.py","src/quarry_recon/release_h0_identity.py","src/quarry_recon/release_h0_inner.py","src/quarry_recon/release_v310_05.py","src/quarry_recon/release_v310_08.py","src/quarry_recon/remainder.py","src/quarry_recon/report_truth.py","src/quarry_recon/repository_identity.py","src/quarry_recon/resource_contract.py","src/quarry_recon/revision.py","src/quarry_recon/run_manifest.py","src/quarry_recon/runner.py","src/quarry_recon/runner_containment.py","src/quarry_recon/runner_ipc.py","src/quarry_recon/runner_native.py","src/quarry_recon/runner_protocol.py","src/quarry_recon/runner_repository.py","src/quarry_recon/runner_streams.py","src/quarry_recon/runner_supervisor.py","src/quarry_recon/runner_worker.py","src/quarry_recon/runtime_identity.py","src/quarry_recon/secrets.py","src/quarry_recon/settings.py","src/quarry_recon/settle.py","src/quarry_recon/shodan_host.py","src/quarry_recon/shodan_sched.py","src/quarry_recon/source_registry_evidence.py","src/quarry_recon/sources.py","src/quarry_recon/state.py","src/quarry_recon/store.py","src/quarry_recon/sweep.py","src/quarry_recon/triage.py","src/quarry_recon/views.py","src/quarry_recon/whoxy_page.py"],"tool":"coverage","version":"7.15.4"}
